<?xml version="1.0" ?>
<!--
    $Id: test_5_wirewrap_base.xml,v 1.1 2005/11/01 11:58:00 james Exp $

    $Log: test_5_wirewrap_base.xml,v $
    Revision 1.1  2005/11/01 11:58:00  james
    Some renaming to make more sense, getting ready for
    second stage of pipeline

    Revision 1.1  2005/10/05 12:45:33  james
    Got nested style XML working

    Revision 1.2  2005/10/04 13:43:46  james
    Got some more testcases working for wirewrap

    Revision 1.3  2005/08/31 12:41:53  james
    Testcase 3 now processes style and behavior xml
    on browsers that have XSLT support.

    Revision 1.2  2005/08/31 10:23:19  james
    Adding xsd directort for schema definitions

    Revision 1.1  2005/08/29 08:04:10  james
    Latest wirewrap test

    Revision 1.1  2005/08/25 12:23:15  james
    Moved code

    Revision 1.4  2005/07/03 03:24:52  james
    Fixed issue in XSLT and in example XML

    Revision 1.3  2005/07/02 13:23:10  james
    Getting schema definition w3 compliant

    
    @brief Example XML for css selector applied HTML/JavaScript behaviors
 -->
<wirewrap xmlns="http://xsd.metawrap.com/wirewrap/1.0/wirewrap.xsd" xmlns:xsi="http://www.w3.org/2001/XMLSchema-instance" xsi:schemaLocation="http://xsd.metawrap.com/wirewrap/1.0/ http://xsd.metawrap.com/wirewrap/1.0/wirewrap.xsd" >
   <selector css="#example li">
      <onclick>this.parentNode.removeChild(this); return false;</onclick>
   </selector>

   <selector css="#fading-list li">
      <onclick>new Effect2.Fade(this); return false;</onclick>
   </selector>

   <selector css="ul#sortable-list">
      <constructor>Sortable.create(p_e);</constructor>
   </selector>

   <selector css="#shaky li">
      <onclick>new Effect2.Shake(this);</onclick>
   </selector>

   <selector css=".dropout li">
      <onclick>new Effect2.DropOut(this);</onclick>

      <onmouseover>this.className = "hover";</onmouseover>

      <onmouseout>this.className = "";</onmouseout>
   </selector>
   
    <selector css=".wrap">        
        <style>
            width: 67%;
            margin: 0 0 1em 14%;
            padding: 2% 3% 2% 5%;
            BACKGROUND: white;
            border-style: solid;
            border-width: 1px;
            top: -1px;                
        </style>              
    </selector>

    <selector css="h1,h2,h3,h4">        
        <style>
            position: relative;
            left: -1em;
            clear: both;
        </style>              
    </selector>

    <selector css="body">        
        <style>
        margin: 0;
        padding: 0;
        background: #FC0;
        font: 0.8em trebuchet ms;
        </style>              
    </selector>

    <selector css="em">        
        <style>
            background: #ffc;
        </style>              
    </selector>

    <selector css="pre">        
        <style>        
            font-size: 1.1em;
            background: #f0f0f0;
            -moz-border-radius: 10px;
            padding: 1em;
        </style>              
    </selector>


    <selector css="pre span">        
        <style>       
            font-weight: bold;
        </style>              
    </selector>

    <selector css=".selector, pre b">        
        <style>       
            color: red;
        </style>              
    </selector>


    <selector css=".beh">        
        <style>
            color: blue;
        </style>              
    </selector>

    <selector css=".event">        
        <style>
            color: green;
        </style>              
    </selector>

    <selector css="#sortable-list li">        
        <style>
            cursor:move;
            -moz-user-select: none;
            width: 100%;
        </style>              
    </selector>

    <selector css=".dropout li">        
        <style>
            width: 100px;
            line-height: 100px;
            text-align: center;
            float: left;
            margin: 5px;
            border: 1px solid #ccc;
            list-style: none;
        </style>              
    </selector>


    <selector css=".dropout li.hover">        
        <style>
            background: yellow;
        </style>              
    </selector>   
   
</wirewrap>

