<?xml version="1.0" ?>
<!--
    $Id: test_4_wirewrap_remix.xml,v 1.6 2007/11/07 02:03:50 james Exp $

    $Log: test_4_wirewrap_remix.xml,v $
    Revision 1.6  2007/11/07 02:03:50  james
    Support for new wirewrap operations

    Revision 1.5  2007/10/24 10:35:00  james
    *** empty log message ***

    Revision 1.4  2007/10/24 09:44:12  james
    Working out the semantics of the new skin system

    Revision 1.3  2005/11/09 13:06:36  james
    added stub for smsmodem

    Revision 1.2  2005/11/02 20:55:58  james
    Changed wirewrap to allow window event handlers to be added

    Revision 1.1  2005/11/02 11:41:22  james
    Got basic remix transform happening
    
    @brief Example XML for css selector applied HTML/JavaScript behaviors
 -->
<wirewrap xmlns="http://xsd.metawrap.com/wirewrap/1.0/wirewrap.xsd" xmlns:xsi="http://www.w3.org/2001/XMLSchema-instance" xsi:schemaLocation="http://xsd.metawrap.com/wirewrap/1.0/ http://xsd.metawrap.com/wirewrap/1.0/wirewrap.xsd" >
    <onload>
        alert("Loaded");
    </onload>          
    
    <selector css="*">        
        <style>
            font-family: "Gothic" fantasy;
        </style>              
    </selector>
       
    <selector css="#sortable-list">        
        <remove/>
    </selector>

    <selector css="#sortable-list-heading">
    
        <before><![CDATA[        
            <h2 class="test">before</h2>           
        ]]></before>
    
        <after><![CDATA[        
            <h2 class="test">after</h2>           
        ]]></after>
        
        <add><![CDATA[        
            I am the walrus!
        ]]></add>

        <add><![CDATA[        
            <b>Release the hounds!!</b>
        ]]></add>
        
        <replace><![CDATA[        
            I am replacement content!
        ]]></replace>        
        
        <prefix><![CDATA[        
            <i>*NEW*</i>
        ]]></prefix>        
        
        
        <add><component type="xyz" name="123"></component></add>
        
        <swap css="#fading-list-heading" />
        

    </selector>
    
    <selector css="h2">
        <prefix><![CDATA[        
            Depressing
        ]]></prefix>         
    </selector>      

    <selector css="#sortable-list">
        <replace><![CDATA[        
            <h1 class="test">Replaced!</h1>           
        ]]></replace>
    </selector>    
           
    <selector css="body">
        <style>
            background: black;
        </style>
        <onclick>
            alert("Hello Cruel World");
        </onclick>        
    </selector>   
    
    <selector css=".dropout li.hover">        
        <style>
            background: green;
        </style>              
    </selector>   
    
</wirewrap>